{
  "schema_version": "1.0",
  "result_count": 260,
  "hit_count": 83,
  "results": [
    {
      "module": "S1",
      "rule_id": "R3",
      "rule_name": "营收集中度",
      "hit": false,
      "dimension": {
        "type": "all_categories",
        "name": "__ALL__"
      },
      "period": {
        "start": "2025-08",
        "end": "2025-08"
      },
      "metrics": {
        "top1_revenue": 25426600.79,
        "total_revenue": 79966073.25999999,
        "top1_share": 0.3179673548221943
      },
      "threshold": "Top1品类首单营收占比 > 0.50",
      "evidence": [
        "Top1品类 太极",
        "Top1营收 25426600.79",
        "全品类营收 79966073.26",
        "Top1占比 0.317967"
      ]
    },
    {
      "module": "S1",
      "rule_id": "R4",
      "rule_name": "营收过于分散",
      "hit": false,
      "dimension": {
        "type": "all_categories",
        "name": "__ALL__"
      },
      "period": {
        "start": "2025-08",
        "end": "2025-08"
      },
      "metrics": {
        "top3_revenue": 53327412.64,
        "total_revenue": 79966073.25999999,
        "top3_share": 0.6668754693832769
      },
      "threshold": "Top3品类首单营收占比 < 0.50",
      "evidence": [
        "Top3营收 53327412.64",
        "全品类营收 79966073.26",
        "Top3占比 0.666875"
      ]
    },
    {
      "module": "S1",
      "rule_id": "R3",
      "rule_name": "营收集中度",
      "hit": false,
      "dimension": {
        "type": "all_categories",
        "name": "__ALL__"
      },
      "period": {
        "start": "2025-09",
        "end": "2025-09"
      },
      "metrics": {
        "top1_revenue": 19994095.94,
        "total_revenue": 70307798.7,
        "top1_share": 0.2843794900379949
      },
      "threshold": "Top1品类首单营收占比 > 0.50",
      "evidence": [
        "Top1品类 太极",
        "Top1营收 19994095.94",
        "全品类营收 70307798.70",
        "Top1占比 0.284379"
      ]
    },
    {
      "module": "S1",
      "rule_id": "R4",
      "rule_name": "营收过于分散",
      "hit": false,
      "dimension": {
        "type": "all_categories",
        "name": "__ALL__"
      },
      "period": {
        "start": "2025-09",
        "end": "2025-09"
      },
      "metrics": {
        "top3_revenue": 44482168.150000006,
        "total_revenue": 70307798.7,
        "top3_share": 0.6326775830346115
      },
      "threshold": "Top3品类首单营收占比 < 0.50",
      "evidence": [
        "Top3营收 44482168.15",
        "全品类营收 70307798.70",
        "Top3占比 0.632678"
      ]
    },
    {
      "module": "S1",
      "rule_id": "R3",
      "rule_name": "营收集中度",
      "hit": false,
      "dimension": {
        "type": "all_categories",
        "name": "__ALL__"
      },
      "period": {
        "start": "2025-10",
        "end": "2025-10"
      },
      "metrics": {
        "top1_revenue": 21605221.74,
        "total_revenue": 70761909.57,
        "top1_share": 0.3053227629283719
      },
      "threshold": "Top1品类首单营收占比 > 0.50",
      "evidence": [
        "Top1品类 太极",
        "Top1营收 21605221.74",
        "全品类营收 70761909.57",
        "Top1占比 0.305323"
      ]
    },
    {
      "module": "S1",
      "rule_id": "R4",
      "rule_name": "营收过于分散",
      "hit": false,
      "dimension": {
        "type": "all_categories",
        "name": "__ALL__"
      },
      "period": {
        "start": "2025-10",
        "end": "2025-10"
      },
      "metrics": {
        "top3_revenue": 42048709.739999995,
        "total_revenue": 70761909.57,
        "top3_share": 0.5942280245900379
      },
      "threshold": "Top3品类首单营收占比 < 0.50",
      "evidence": [
        "Top3营收 42048709.74",
        "全品类营收 70761909.57",
        "Top3占比 0.594228"
      ]
    },
    {
      "module": "S1",
      "rule_id": "R5",
      "rule_name": "核心品类下行趋势",
      "hit": true,
      "dimension": {
        "type": "category",
        "name": "东方养正瑜伽"
      },
      "period": {
        "start": "2025-08",
        "end": "2025-10"
      },
      "metrics": {
        "start_revenue": 829025.98,
        "previous_revenue": 684072.33,
        "current_revenue": 679751.19
      },
      "threshold": "连续3个完整月下降",
      "evidence": [
        "2025-08 首单营收 829025.98",
        "2025-09 首单营收 684072.33",
        "2025-10 首单营收 679751.19"
      ]
    },
    {
      "module": "S1",
      "rule_id": "R5",
      "rule_name": "核心品类下行趋势",
      "hit": false,
      "dimension": {
        "type": "category",
        "name": "中医变美"
      },
      "period": {
        "start": "2025-08",
        "end": "2025-10"
      },
      "metrics": {
        "start_revenue": 824498.3,
        "previous_revenue": 1467461.03,
        "current_revenue": 2572659.52
      },
      "threshold": "连续3个完整月下降",
      "evidence": [
        "2025-08 首单营收 824498.30",
        "2025-09 首单营收 1467461.03",
        "2025-10 首单营收 2572659.52"
      ]
    },
    {
      "module": "S1",
      "rule_id": "R5",
      "rule_name": "核心品类下行趋势",
      "hit": true,
      "dimension": {
        "type": "category",
        "name": "云帆太极"
      },
      "period": {
        "start": "2025-08",
        "end": "2025-10"
      },
      "metrics": {
        "start_revenue": 89802.5,
        "previous_revenue": 53075.0,
        "current_revenue": 14963.6
      },
      "threshold": "连续3个完整月下降",
      "evidence": [
        "2025-08 首单营收 89802.50",
        "2025-09 首单营收 53075.00",
        "2025-10 首单营收 14963.60"
      ]
    },
    {
      "module": "S1",
      "rule_id": "R5",
      "rule_name": "核心品类下行趋势",
      "hit": true,
      "dimension": {
        "type": "category",
        "name": "五禽戏"
      },
      "period": {
        "start": "2025-08",
        "end": "2025-10"
      },
      "metrics": {
        "start_revenue": 78271.4,
        "previous_revenue": 10344.6,
        "current_revenue": 8122.56
      },
      "threshold": "连续3个完整月下降",
      "evidence": [
        "2025-08 首单营收 78271.40",
        "2025-09 首单营收 10344.60",
        "2025-10 首单营收 8122.56"
      ]
    },
    {
      "module": "S1",
      "rule_id": "R5",
      "rule_name": "核心品类下行趋势",
      "hit": false,
      "dimension": {
        "type": "category",
        "name": "产研测试"
      },
      "period": {
        "start": "2025-08",
        "end": "2025-10"
      },
      "metrics": {
        "start_revenue": 0.21,
        "previous_revenue": 14001.81,
        "current_revenue": 12.8
      },
      "threshold": "连续3个完整月下降",
      "evidence": [
        "2025-08 首单营收 0.21",
        "2025-09 首单营收 14001.81",
        "2025-10 首单营收 12.80"
      ]
    },
    {
      "module": "S1",
      "rule_id": "R5",
      "rule_name": "核心品类下行趋势",
      "hit": true,
      "dimension": {
        "type": "category",
        "name": "体态"
      },
      "period": {
        "start": "2025-08",
        "end": "2025-10"
      },
      "metrics": {
        "start_revenue": 12800.6,
        "previous_revenue": 6905.5,
        "current_revenue": 5068.0
      },
      "threshold": "连续3个完整月下降",
      "evidence": [
        "2025-08 首单营收 12800.60",
        "2025-09 首单营收 6905.50",
        "2025-10 首单营收 5068.00"
      ]
    },
    {
      "module": "S1",
      "rule_id": "R5",
      "rule_name": "核心品类下行趋势",
      "hit": true,
      "dimension": {
        "type": "category",
        "name": "健康营养"
      },
      "period": {
        "start": "2025-08",
        "end": "2025-10"
      },
      "metrics": {
        "start_revenue": 2094601.37,
        "previous_revenue": 1766619.7,
        "current_revenue": 1733990.3
      },
      "threshold": "连续3个完整月下降",
      "evidence": [
        "2025-08 首单营收 2094601.37",
        "2025-09 首单营收 1766619.70",
        "2025-10 首单营收 1733990.30"
      ]
    },
    {
      "module": "S1",
      "rule_id": "R5",
      "rule_name": "核心品类下行趋势",
      "hit": false,
      "dimension": {
        "type": "category",
        "name": "健康食养"
      },
      "period": {
        "start": "2025-08",
        "end": "2025-10"
      },
      "metrics": {
        "start_revenue": 491859.47,
        "previous_revenue": 1140783.06,
        "current_revenue": 2493965.55
      },
      "threshold": "连续3个完整月下降",
      "evidence": [
        "2025-08 首单营收 491859.47",
        "2025-09 首单营收 1140783.06",
        "2025-10 首单营收 2493965.55"
      ]
    },
    {
      "module": "S1",
      "rule_id": "R5",
      "rule_name": "核心品类下行趋势",
      "hit": false,
      "dimension": {
        "type": "category",
        "name": "古法居家养生"
      },
      "period": {
        "start": "2025-08",
        "end": "2025-10"
      },
      "metrics": {
        "start_revenue": 9059.2,
        "previous_revenue": 10297.15,
        "current_revenue": 2210.0
      },
      "threshold": "连续3个完整月下降",
      "evidence": [
        "2025-08 首单营收 9059.20",
        "2025-09 首单营收 10297.15",
        "2025-10 首单营收 2210.00"
      ]
    },
    {
      "module": "S1",
      "rule_id": "R5",
      "rule_name": "核心品类下行趋势",
      "hit": false,
      "dimension": {
        "type": "category",
        "name": "君合太极"
      },
      "period": {
        "start": "2025-08",
        "end": "2025-10"
      },
      "metrics": {
        "start_revenue": 0.0,
        "previous_revenue": 39937.0,
        "current_revenue": 168016.01
      },
      "threshold": "连续3个完整月下降",
      "evidence": [
        "2025-08 首单营收 0.00",
        "2025-09 首单营收 39937.00",
        "2025-10 首单营收 168016.01"
      ]
    },
    {
      "module": "S1",
      "rule_id": "R5",
      "rule_name": "核心品类下行趋势",
      "hit": true,
      "dimension": {
        "type": "category",
        "name": "唱歌"
      },
      "period": {
        "start": "2025-08",
        "end": "2025-10"
      },
      "metrics": {
        "start_revenue": 15709396.16,
        "previous_revenue": 14888610.23,
        "current_revenue": 13606608.91
      },
      "threshold": "连续3个完整月下降",
      "evidence": [
        "2025-08 首单营收 15709396.16",
        "2025-09 首单营收 14888610.23",
        "2025-10 首单营收 13606608.91"
      ]
    },
    {
      "module": "S1",
      "rule_id": "R5",
      "rule_name": "核心品类下行趋势",
      "hit": false,
      "dimension": {
        "type": "category",